{
  "$schema": "https://json-schema.org/draft/2020-12/schema",
  "title": "Made by Matt lesson catalogue",
  "type": "array",
  "items": {
    "type": "object",
    "additionalProperties": false,
    "required": [
      "id",
      "subject",
      "title",
      "file",
      "type",
      "family"
    ],
    "properties": {
      "id": {
        "type": "string",
        "pattern": "^[a-z0-9-]+$"
      },
      "subject": {
        "type": "string",
        "minLength": 1
      },
      "title": {
        "type": "string",
        "minLength": 1
      },
      "file": {
        "type": "string",
        "minLength": 1
      },
      "type": {
        "enum": [
          "lesson",
          "game",
          "revision",
          "pupil",
          "teacher",
          "support",
          "hub",
          "Lesson",
          "Hub"
        ],
        "description": "Record type. 'Lesson', 'Hub' and 'hub' are legacy spellings already carried by 105 rows (UX2 A1, 2026-09-08); new rows use the lower-case forms."
      },
      "family": {
        "type": "string",
        "minLength": 1
      },
      "keywords": {
        "type": "array",
        "items": {
          "type": "string"
        },
        "description": "Search keywords. Absent on 88 legacy rows that carry description/thumbnail instead (measured 2026-09-08); required on new rows by the UX2 catalogue tools. uniqueItems is not asserted: 8 reviewed shelf rows (743-750) repeat a keyword and are digest-locked."
      },
      "added": {
        "type": "string",
        "pattern": "^\\d{4}-\\d{2}-\\d{2}$"
      },
      "new": {
        "type": "boolean"
      },
      "desc": {
        "type": "string"
      },
      "thumb": {
        "type": "string"
      },
      "year": {
        "type": "string",
        "enum": [
          "2025-26",
          "2026-27"
        ],
        "description": "Academic year the resource belongs to"
      },
      "featured": {
        "type": "boolean"
      },
      "description": {
        "type": "string",
        "description": "Legacy alias of desc on 88 rows; new rows use desc."
      },
      "thumbnail": {
        "type": "string",
        "description": "Legacy thumbnail path on 88 rows; new rows use thumb."
      },
      "halfTerm": {
        "type": "string",
        "enum": [
          "Autumn 1",
          "Autumn 2",
          "Spring 1",
          "Spring 2",
          "Summer 1",
          "Summer 2"
        ],
        "description": "UX2 A1 (2026-09-08): the half-term the lesson resolves to, from the lesson's own declaration or a scheme-of-work cell; labels are the spine's (_sownb/TERM_DATES.md). Never derived from a filename. Written only by tools/ux2/unit_tags.py."
      },
      "unit": {
        "type": "string",
        "minLength": 1,
        "description": "UX2 A1 (2026-09-08): the unit the lesson belongs to, only when its own metadata, its pack index / START_HERE, or a scheme-of-work row naming the same title states one. Written only by tools/ux2/unit_tags.py."
      },
      "kind": {
        "enum": [
          "pack"
        ],
        "description": "UX2 D3 (2026-09-08): record kind for non-lesson entries. 'pack' = a companion pack (editable slides and documents) for one deployed lesson; the pack's HTML is never deployed. Written only by tools/ux2/companion_catalogue.py."
      },
      "companionOf": {
        "type": "string",
        "minLength": 1,
        "description": "UX2 D3: the deployed lesson this pack was matched to (D1: sha256, exact title, or normalised filename), as a catalogue-relative path. The lesson is canonical; the pack never edits it."
      },
      "builtFrom": {
        "type": "string",
        "pattern": "^[0-9a-f]{64}$",
        "description": "UX2 D3: sha256 of the pack's own source HTML, recorded when the deployed lesson was matched by title or filename rather than by digest."
      },
      "packRevisionDrift": {
        "type": "boolean",
        "description": "UX2 D3: true when the pack HTML and the deployed lesson differ in title, learning-objective line or stage minutes (D1 DRIFT check). Teacher-facing only: 'Built from an earlier revision of this lesson.'"
      },
      "files": {
        "type": "array",
        "minItems": 1,
        "items": {
          "type": "object",
          "additionalProperties": false,
          "required": [
            "role",
            "type",
            "path"
          ],
          "properties": {
            "role": {
              "enum": [
                "lesson",
                "teacher",
                "pupil",
                "slides"
              ]
            },
            "type": {
              "enum": [
                "pptx",
                "docx",
                "pdf"
              ]
            },
            "path": {
              "type": "string",
              "minLength": 1
            },
            "label": {
              "type": "string",
              "minLength": 1,
              "description": "tq add.1 Q3: optional label of record, shown first by the pack page."
            },
            "download": {
              "type": "string",
              "pattern": "^https://github\\.com/MattRoper1977/Lessons/raw/[0-9a-f]{40}/",
              "description": "um-4 (a): an earlier-version member kept in the repository but not published; the pack page links this pinned download instead of the path."
            }
          }
        },
        "description": "UX2 D3: the pack's landed files, one entry each; role and type are the closed sets the order names. Held files (D2) are not listed."
      },
      "_shelfPathway": {
        "type": "string",
        "enum": [
          "BUILD",
          "GROW",
          "LAUNCH"
        ],
        "description": "Shelf pathway carried by a shelf-supplied row that has no pathway segment of its own; read by the hub's tierOf (qv-5 scratch)."
      }
    }
  },
  "description": "Made by Matt lesson catalogue. Enforced by tools/ux2/check_catalogue_schema.py (UX2 A1); additionalProperties is false, so a new key needs a schema change first. UX2 D3 (2026-09-08) added kind, companionOf, builtFrom, packRevisionDrift and files for companion-pack entries."
}
