{
  "subject": "GROW Vocational & PfA",
  "title": "GROW Computing · Programming with Scratch · Weeks 1–8",
  "file": "ICT/Teaching_Packs/index.html#grow-computing",
  "id": "grow-computing-scratch-71638",
  "type": "hub",
  "family": "ICT",
  "keywords": [
    "computing",
    "ict",
    "grow",
    "scratch",
    "programming",
    "AQA",
    "UAS",
    "71638",
    "unit 6",
    "Level One",
    "maze",
    "debugging",
    "eight weeks",
    "40 minutes",
    "teaching pack",
    "powerpoint",
    "word",
    "pdf",
    "paper evidence",
    "Scratch projects"
  ],
  "desc": "Eight 40-minute lessons for AQA UAS 71638, Programming with Scratch (unit 6), Level One. Build and test Scratch projects on a laptop, with editable slides, pupil booklets, printable paper activities and teacher guidance. Capture completed work for printed evidence; unit weeks are sequence labels.",
  "added": "2026-09-12",
  "new": true,
  "year": "2026-27"
}
